id,question_id,user_answer,teacher_key,score_sbert,feedback_A_rule,feedback_B_keybert,feedback_C_template,feedback_D_gemini,feedback_E_hybrid
94,334,dampaknya adalah kenaikan suhu bumi yang dapat mengakibatkan melelehnya es dan menaikkan ketinggian permukaan air laut,"Sinar ultraviolet (UV) masuk ke bumi tanpa filter, memicu kanker kulit, katarak, dan kerusakan ekosistem.",37.81,Jawaban tidak relevan dengan kunci jawaban.,"Jawaban belum mencakup konsep penting: sinar ultraviolet, ultraviolet uv, ultraviolet, tanpa filter.",Jawaban belum sesuai kunci jawaban (37.8%). Pelajari ulang materi dan coba jawab dengan kata-kata sendiri.,"Jawaban siswa kurang tepat karena menjelaskan dampak pemanasan global, padahal kunci jawaban fokus pada dampak penipisan lapisan ozon (radiasi UV). Siswa perlu memperbaiki pemahaman mengenai perbedaan antara efek rumah kaca dan kerusakan lapisan ozon agar tidak tertukar dampaknya.","Jawaban Anda belum mencakup kata kunci penting ""sinar ultraviolet"" karena Anda justru menjelaskan dampak pemanasan global secara umum. Fokuslah pada dampak spesifik dari paparan radiasi UV sesuai dengan kunci jawaban."
95,335,mematikan keran air ketika sudah tidak digunakan,"Mematikan keran air saat menyabuni tangan atau menyikat gigi, serta memperbaiki kebocoran pipa.",76.05,"Bagus, namun ada sedikit perbedaan istilah.",Jawaban sudah mencakup seluruh poin penting dari kunci jawaban.,Jawaban cukup baik (76.0% sesuai kunci). Coba tambahkan detail atau istilah yang lebih spesifik sesuai materi.,"Jawaban siswa sudah benar secara prinsip, namun kurang spesifik dibandingkan kunci jawaban yang menekankan penghematan saat aktivitas berlangsung dan pemeliharaan pipa. Untuk meningkatkan nilai, siswa perlu menambahkan contoh konkret seperti mematikan keran saat menyabuni tangan atau memperbaiki kebocoran.","Jawaban sudah mencantumkan kata kunci ""mematikan keran"", namun belum mencakup detail penting seperti ""saat menyabuni"" atau ""menyikat gigi"". Penjelasan tersebut perlu ditambahkan agar lebih spesifik dan sesuai dengan kunci jawaban."
96,336,"karena proses pembakaran mesin melepaskan emisi gas beracun secara masif, seperti karbon monoksida (CO), nitrogen oksida (
), dan partikulat (PM2.5/PM10). Emisi ini memicu pemanasan global, kabut asap, serta dampak kesehatan",Pembakaran bahan bakar fosil melepaskan gas berbahaya seperti karbon monoksida dan karbon dioksida ke atmosfer.,67.27,"Kurang tepat, perbaiki lagi konsepnya.","Jawaban belum mencakup konsep penting: ke atmosfer, bahan bakar.",Jawaban cukup baik (67.3% sesuai kunci). Coba tambahkan detail atau istilah yang lebih spesifik sesuai materi.,"Jawaban siswa sebenarnya sangat lengkap dan akurat secara ilmiah, bahkan melampaui detail kunci jawaban dengan menyebutkan polutan spesifik lainnya. Nilai tersebut kemungkinan diberikan karena siswa tidak secara eksplisit menyebutkan ""karbon dioksida"" (CO2) dan ""bahan bakar fosil"" yang merupakan kata kunci utama dalam kunci jawaban.","Jawaban siswa telah mencakup kata kunci ""melepaskan gas"" dan ""gas berbahaya"" melalui penjelasan yang sangat detail dan akurat. Meskipun frasa ""ke atmosfer"" tidak tertulis secara eksplisit, penjelasan mengenai dampak lingkungan sudah mencakup konteks tersebut dengan sangat baik."
97,327,"fenomena peningkatan suhu rata-rata atmosfer, lautan, dan daratan Bumi secara bertahap dan signifikan dalam jangka panjang","Peningkatan suhu rata-rata atmosfer, laut, dan daratan bumi secara global.",82.89,"Bagus, namun ada sedikit perbedaan istilah.",Jawaban sudah mencakup seluruh poin penting dari kunci jawaban.,Jawaban cukup baik (82.9% sesuai kunci). Coba tambahkan detail atau istilah yang lebih spesifik sesuai materi.,"Jawaban siswa sudah sangat akurat dan lebih komprehensif karena menambahkan aspek ""jangka panjang"" dan ""bertahap"" yang melengkapi definisi tersebut. Nilai tersebut sangat baik, namun mungkin sedikit berkurang karena tidak mencantumkan kata ""global"" secara eksplisit sebagaimana tertera pada kunci jawaban.","Jawaban siswa sangat akurat dan telah mencakup seluruh kata kunci penting secara lengkap. Penjelasan mengenai peningkatan suhu pada atmosfer, laut, dan daratan Bumi sudah tersampaikan dengan sangat baik."
98,328,"Penanaman pohon (reboisasi) dinilai sebagai salah satu solusi paling efektif untuk mengatasi perubahan iklim karena pohon bekerja sebagai ""penyerap karbon alami"" yang krusial. 
Berikut adalah alasan utama mengapa reboisasi sangat efektif:
1. Penyerapan Karbon Dioksida (Sekuestrasi Karbon) 
Pohon menyerap karbon dioksida (
) dari atmosfer melalui proses fotosintesis. Karbon tersebut kemudian disimpan dalam bentuk biomassa (kayu, akar, dan daun) selama masa hidup pohon. Dengan mengurangi konsentrasi 
 di atmosfer, pohon membantu menahan laju pemanasan global. 
2. Efek Pendinginan (Evapotranspirasi) 
Pohon tidak hanya menyerap gas rumah kaca, tetapi juga mendinginkan suhu lingkungan secara langsung. Melalui proses evapotranspirasi, pohon melepaskan uap air ke udara yang membantu menurunkan suhu permukaan bumi di sekitarnya. Ini sangat efektif untuk mengurangi efek ""pulau panas"" (urban heat island) di perkotaan. 
3. Mitigasi Bencana Alam
Perubahan iklim membawa cuaca ekstrem. Reboisasi membantu memitigasi dampaknya: 
Pencegahan Banjir: Akar pohon meningkatkan daya serap tanah, sehingga mengurangi limpasan air permukaan.
Pencegahan Longsor: Akar pohon mengikat struktur tanah di lereng-lereng curam. 
4. Pelestarian Keanekaragaman Hayati
Hutan yang ditanam kembali menyediakan habitat bagi berbagai spesies flora dan fauna. Ekosistem yang sehat dan beragam memiliki ketahanan (resiliensi) yang lebih baik terhadap perubahan iklim dibandingkan ekosistem yang rusak. 
5. Siklus Hidrologi yang Lebih Baik 
Hutan berperan penting dalam menjaga siklus air. Penanaman pohon membantu mengisi kembali cadangan air tanah dan menjaga ketersediaan air bersih, yang sering kali terancam oleh kekeringan akibat perubahan iklim.",Pohon menyerap karbon dioksida (CO2) dan menghasilkan oksigen (O2) melalui proses fotosintesis.,58.45,"Kurang tepat, perbaiki lagi konsepnya.","Jawaban belum mencakup konsep penting: dioksida co2, co2 dan, co2.",Jawaban kurang tepat (58.4% sesuai kunci). Periksa kembali konsep utama dan gunakan kata kunci yang relevan.,"Jawaban siswa sangat komprehensif dan sudah mencakup inti kunci jawaban pada poin pertama, sehingga secara substansi sudah sangat tepat dan berkualitas. Nilai tersebut kemungkinan rendah karena sistem penilaian hanya mencari kecocokan kata yang kaku, padahal penjelasan tambahan yang diberikan sangat akurat dalam konteks ilmiah.","Jawaban siswa sudah mencakup kata kunci ""karbon dioksida (CO2)"", namun belum menyebutkan poin penting mengenai proses ""menghasilkan oksigen"". Meskipun begitu, penjelasan yang diberikan sudah sangat mendalam dan relevan dalam menjelaskan peran pohon bagi lingkungan."
99,331,"Penggunaan kantong belanja kain lebih disarankan karena dapat digunakan kembali secara berulang, kuat, dan tahan lama, yang secara signifikan mengurangi tumpukan sampah plastik sekali pakai. Kantong kain membantu menurunkan emisi karbon, mencegah pencemaran lingkungan, dan mengurangi dampak buruk limbah plastik yang sulit terurai terhadap ekosistem darat maupun",Kantong kain dapat digunakan berulang kali (reusable) sehingga mengurangi timbulan limbah plastik sekali pakai.,68.88,"Kurang tepat, perbaiki lagi konsepnya.","Jawaban belum mencakup konsep penting: kali reusable, berulang kali, digunakan berulang.",Jawaban cukup baik (68.9% sesuai kunci). Coba tambahkan detail atau istilah yang lebih spesifik sesuai materi.,"Jawaban siswa sudah sangat baik dan lebih komprehensif dari kunci jawaban, namun nilainya tidak maksimal karena kalimat terakhir terputus atau tidak selesai. Untuk memperbaikinya, pastikan setiap pernyataan diakhiri dengan tanda baca yang tepat dan gagasan yang utuh agar tidak menggantung.","Jawaban Anda sudah mencakup kata kunci penting ""digunakan kembali secara berulang"" dengan penjelasan yang sangat lengkap dan mendalam. Penjelasan tambahan mengenai dampak lingkungan semakin memperkuat argumen dalam jawaban tersebut."
100,332,"proses daur ulang adalah proses mengolah kembali sampah, baik itu organik dan anorganik, untuk digunakan kembali menjadi barang yang berguna",Proses mengolah kembali barang bekas atau limbah menjadi produk baru yang memiliki nilai guna.,71.36,"Kurang tepat, perbaiki lagi konsepnya.","Jawaban belum mencakup konsep penting: produk baru, produk, menjadi produk.",Jawaban cukup baik (71.4% sesuai kunci). Coba tambahkan detail atau istilah yang lebih spesifik sesuai materi.,"Jawaban siswa sudah sangat baik karena berhasil menjelaskan inti dari daur ulang, yaitu mengolah kembali sampah menjadi barang bermanfaat. Nilai tersebut diberikan karena meskipun substansinya benar, redaksi jawaban siswa kurang menekankan pada istilah ""produk baru"" sebagaimana yang tercantum dalam kunci jawaban.","Jawaban Anda sudah menjelaskan inti daur ulang dengan baik, meskipun kata kunci spesifik ""produk baru"" belum tertulis secara eksplisit. Penggunaan istilah ""barang yang berguna"" sudah mewakili esensi dari kata kunci tersebut."
101,329,"Sampah organik adalah sampah yang berasal dari bahan-bahan alami yang dapat terurai oleh proses biologis, seperti sisa makanan, daun kering, dan kulit buah. Sementara itu, sampah anorganik adalah sampah yang berasal dari bahan-bahan non-alami dan tidak mudah terurai, seperti plastik, kaca, dan logam.","Sampah organik mudah terurai secara alami, sedangkan sampah anorganik sulit atau tidak dapat terurai secara alami.",66.8,"Kurang tepat, perbaiki lagi konsepnya.",Jawaban belum mencakup konsep penting: secara alami.,Jawaban cukup baik (66.8% sesuai kunci). Coba tambahkan detail atau istilah yang lebih spesifik sesuai materi.,"Jawaban siswa sudah sangat akurat dan jauh lebih lengkap daripada kunci jawaban karena mencakup definisi sumber bahan serta contoh konkretnya. Nilai tersebut kemungkinan rendah karena ketidaksesuaian kata kunci secara harfiah, padahal secara substansi jawaban ini sudah sempurna dan tidak perlu diperbaiki.",Jawaban siswa sudah sangat lengkap dan telah mencakup seluruh kata kunci penting dengan penjelasan yang akurat. Perbedaan proses penguraian antara sampah organik dan anorganik telah dijelaskan dengan sangat baik beserta contohnya.
102,330,tersumbatnya aliran dan berakhir banjir,Menyumbat aliran air yang menyebabkan banjir serta mencemari ekosistem dan biota air.,53.68,"Kurang tepat, perbaiki lagi konsepnya.","Jawaban belum mencakup konsep penting: biota air, air yang.",Jawaban kurang tepat (53.7% sesuai kunci). Periksa kembali konsep utama dan gunakan kata kunci yang relevan.,"Jawaban sudah benar dalam menjelaskan dampak banjir, namun nilainya belum maksimal karena melewatkan poin mengenai pencemaran ekosistem dan biota air. Siswa perlu melengkapi jawaban dengan dampak kerusakan lingkungan perairan agar lebih menyeluruh sesuai kunci jawaban.","Jawaban Anda sudah mencakup kata kunci ""menyumbat aliran"" dan ""menyebabkan banjir"", namun belum menyebutkan tentang ""biota air"". Lengkapi jawaban dengan dampak terhadap ekosistem air agar lebih menyeluruh."
103,333,Salah satu aktivitas rumah tangga yang paling sering memboroskan energi listrik adalah penggunaan AC (Air Conditioner) dengan suhu yang terlalu rendah di ruangan yang tidak tertutup rapat. cara mengatasinya adalah Pastikan pintu dan jendela tertutup rapat saat AC menyala agar tidak ada kebocoran udara dingin.,Membiarkan lampu atau alat elektronik menyala saat tidak digunakan; solusinya adalah mematikannya setelah dipakai.,56.41,"Kurang tepat, perbaiki lagi konsepnya.","Jawaban belum mencakup konsep penting: digunakan solusinya, membiarkan lampu, elektronik menyala, solusinya adalah.",Jawaban kurang tepat (56.4% sesuai kunci). Periksa kembali konsep utama dan gunakan kata kunci yang relevan.,"Jawaban siswa sudah benar secara logika dalam menjelaskan pemborosan energi pada AC, namun nilainya belum maksimal karena berbeda dengan fokus kunci jawaban yang menekankan pada perilaku mematikan alat saat tidak dipakai. Siswa perlu lebih memperhatikan instruksi spesifik mengenai kebiasaan mematikan perangkat elektronik secara total untuk menghemat energi.",Jawaban siswa belum mencakup kata kunci penting karena lebih fokus pada efisiensi penggunaan AC daripada tindakan mematikan lampu atau alat elektronik saat tidak digunakan. Penjelasan tersebut belum sesuai dengan inti dari kunci jawaban yang diminta.
